### ISSUE TITLE
GUI: PV reconnection issues

### ISSUE THREAD

**Issue by mattclarke** [ISISComputingGroup/IBEX#2162]
The IBEX GUI generally takes significantly longer to connect to a PV on a newly started IOC than a vanilla version of CS-Studio does. 

It does not matter if it is a block or an OPI. When an OPI does start reconnecting it can take a couple of minutes for all the PVs to reconnect.

We need to get to the bottom of this.

A possible causes for this could be that the GUI is using a lot of resources, so it missing the reconnection or failing to act on it quickly. Alternatively it could be the PVManager is ignoring it.

It is proposed that we add code to acknowledge when the PVManager gets the PV beacon and reconnects to the PV. This might require us modifying the PVManager or CAJ. Knowing the answer to this will bring us closer to working out what is going on.

**Comment by John-Holt-Tessella** [comment]
I have documented creating a logging version of the code [here](https://github.com/ISISComputingGroup/ibex_developers_manual/wiki/PV-Manager-and-Observers)

Here is one example where the GUI appears to connect later than required:


## camonitor

```
TE:NDW1407:EUROTHRM_01:A01:TEMP <undefined> 0 UDF INVALID
TE:NDW1407:EUROTHRM_01:A01:TEMP 2017-03-27 10:37:05.044501 0
TE:NDW1407:CS:SB:TEMP1         2017-03-27 10:37:18.855323 0
```

## logged in gui

```
             unknown = 10:37:00: CATransport read
             unknown = 10:37:00: CATransport processRead start
             unknown = 10:37:00: CATransport handle response
             unknown = 10:37:00: CATransport processRead end
NSTETC_01:DEVIOS:TOD = 10:37:00: PVReaderImpl valueChange
NSTETC_01:DEVIOS:TOD = 10:37:00: PVManagerObservable valueChange true
             unknown = 10:37:00: CATransport read
             unknown = 10:37:00: CATransport processRead start
             unknown = 10:37:00: CATransport handle response
             unknown = 10:37:00: CATransport processRead end
W1407:DAE:VETOSTATUS = 10:37:00: PVReaderImpl valueChange
W1407:DAE:VETOSTATUS = 10:37:00: PVReaderImpl valueChange
W1407:DAE:VETOSTATUS = 10:37:00: PVManagerObservable valueChange true
W1407:DAE:VETOSTATUS = 10:37:00: PVManagerObservable valueChange true
             unknown = 10:37:00: CATransport read
             unknown = 10:37:00: CATransport processRead start
             unknown = 10:37:00: CATransport handle response
             unknown = 10:37:00: CATransport processRead end
:CS:BLOCKSERVER:IOCS = 10:37:00: PVReaderImpl valueChange
:CS:BLOCKSERVER:IOCS = 10:37:00: PVReaderImpl valueChange
:CS:BLOCKSERVER:IOCS = 10:37:00: PVManagerObservable valueChange true
:CS:BLOCKSERVER:IOCS = 10:37:00: PVManagerObservable valueChange true
             unknown = 10:37:00: CATransport processRead start
             unknown = 10:37:00: CATransport processRead end
             unknown = 10:37:00: CATransport processRead start
             unknown = 10:37:00: CATransport processRead end
             unknown = 10:37:00: CATransport processRead start
             unknown = 10:37:00: CATransport processRead end
             unknown = 10:37:00: CATransport processRead start
             unknown = 10:37:00: CATransport handle response
             unknown = 10:37:00: CATransport processRead end
OCKSERVER:PVS:ACTIVE = 10:37:00: PVReaderImpl valueChange
OCKSERVER:PVS:ACTIVE = 10:37:00: PVManagerObservable valueChange true
             unknown = 10:37:01: CATransport read
             unknown = 10:37:01: CATransport processRead start
             unknown = 10:37:01: CATransport handle response
             unknown = 10:37:01: CATransport processRead end
NSTETC_01:DEVIOS:TOD = 10:37:01: PVReaderImpl valueChange
NSTETC_01:DEVIOS:TOD = 10:37:01: PVManagerObservable valueChange true
             unknown = 10:37:01: CATransport read
             unknown = 10:37:01: CATransport processRead start
             unknown = 10:37:01: CATransport processRead end
             unknown = 10:37:01: CATransport processRead start
             unknown = 10:37:01: CATransport processRead end
             unknown = 10:37:01: CATransport processRead start
             unknown = 10:37:01: CATransport processRead end
             unknown = 10:37:01: CATransport processRead start
             unknown = 10:37:01: CATransport processRead end
             unknown = 10:37:01: CATransport processRead start
             unknown = 10:37:01: CATransport processRead end
             unknown = 10:37:01: CATransport processRead start
             unknown = 10:37:01: CATransport processRead end
             unknown = 10:37:01: CATransport processRead start
             unknown = 10:37:01: CATransport handle response
             unknown = 10:37:01: CATransport processRead end
ER:PVS:INTEREST:HIGH = 10:37:01: PVReaderImpl valueChange
ER:PVS:INTEREST:HIGH = 10:37:01: PVManagerObservable valueChange true
             unknown = 10:37:01: CATransport processRead start
             unknown = 10:37:01: CATransport processRead end
             unknown = 10:37:01: CATransport processRead start
             unknown = 10:37:01: CATransport processRead end
             unknown = 10:37:01: CATransport processRead start
             unknown = 10:37:01: CATransport processRead end
             unknown = 10:37:01: CATransport processRead start
             unknown = 10:37:01: CATransport processRead end
             unknown = 10:37:01: CATransport processRead start
             unknown = 10:37:01: CATransport processRead end
             unknown = 10:37:01: CATransport processRead start
             unknown = 10:37:01: CATransport handle response
             unknown = 10:37:01: CATransport processRead end
OCKSERVER:PVS:ACTIVE = 10:37:01: PVReaderImpl valueChange
OCKSERVER:PVS:ACTIVE = 10:37:01: PVManagerObservable valueChange true
             unknown = 10:37:01: CATransport processRead start
             unknown = 10:37:01: CATransport processRead end
             unknown = 10:37:01: CATransport processRead start
             unknown = 10:37:01: CATransport processRead end
             unknown = 10:37:01: CATransport processRead start
             unknown = 10:37:01: CATransport processRead end
             unknown = 10:37:01: CATransport processRead start
             unknown = 10:37:01: CATransport processRead end
             unknown = 10:37:01: CATransport processRead start
             unknown = 10:37:01: CATransport processRead end
             unknown = 10:37:01: CATransport processRead start
             unknown = 10:37:01: CATransport processRead end
             unknown = 10:37:01: CATransport processRead start
             unknown = 10:37:01: CATransport processRead end
             unknown = 10:37:01: CATransport processRead start
             unknown = 10:37:01: CATransport handle response
             unknown = 10:37:01: CATransport processRead end
             unknown = 10:37:01: CATransport processRead start
             unknown = 10:37:01: CATransport processRead end
             unknown = 10:37:01: CATransport processRead start
             unknown = 10:37:01: CATransport processRead end
             unknown = 10:37:01: CATransport processRead start
             unknown = 10:37:01: CATransport processRead end
             unknown = 10:37:01: CATransport processRead start
             unknown = 10:37:01: CATransport processRead end
:PVS:INTEREST:MEDIUM = 10:37:01: PVReaderImpl valueChange
             unknown = 10:37:01: CATransport processRead start
:PVS:INTEREST:MEDIUM = 10:37:01: PVManagerObservable valueChange true
             unknown = 10:37:01: CATransport handle response
             unknown = 10:37:01: CATransport processRead end
:BLOCKSERVER:PVS:ALL = 10:37:01: PVReaderImpl valueChange
:BLOCKSERVER:PVS:ALL = 10:37:01: PVManagerObservable valueChange true
             unknown = 10:37:02: CATransport read
             unknown = 10:37:02: CATransport processRead start
             unknown = 10:37:02: CATransport handle response
             unknown = 10:37:02: CATransport processRead end
NSTETC_01:DEVIOS:TOD = 10:37:02: PVReaderImpl valueChange
NSTETC_01:DEVIOS:TOD = 10:37:02: PVManagerObservable valueChange true
             unknown = 10:37:02: CATransport read
             unknown = 10:37:02: CATransport processRead start
             unknown = 10:37:02: CATransport handle response
             unknown = 10:37:02: CATransport processRead end
W1407:DAE:VETOSTATUS = 10:37:02: PVReaderImpl valueChange
W1407:DAE:VETOSTATUS = 10:37:02: PVReaderImpl valueChange
W1407:DAE:VETOSTATUS = 10:37:02: PVManagerObservable valueChange true
W1407:DAE:VETOSTATUS = 10:37:02: PVManagerObservable valueChange true
             unknown = 10:37:03: CATransport read
             unknown = 10:37:03: CATransport processRead start
             unknown = 10:37:03: CATransport processRead end
             unknown = 10:37:03: CATransport processRead start
             unknown = 10:37:03: CATransport processRead end
             unknown = 10:37:03: CATransport processRead start
             unknown = 10:37:03: CATransport processRead end
             unknown = 10:37:03: CATransport processRead start
             unknown = 10:37:03: CATransport processRead end
             unknown = 10:37:03: CATransport processRead start
             unknown = 10:37:03: CATransport handle response
             unknown = 10:37:03: CATransport processRead end
ER:PVS:INTEREST:HIGH = 10:37:03: PVReaderImpl valueChange
ER:PVS:INTEREST:HIGH = 10:37:03: PVManagerObservable valueChange true
             unknown = 10:37:03: CATransport processRead start
             unknown = 10:37:03: CATransport processRead end
             unknown = 10:37:03: CATransport processRead start
             unknown = 10:37:03: CATransport processRead end
             unknown = 10:37:03: CATransport processRead start
             unknown = 10:37:03: CATransport processRead end
             unknown = 10:37:03: CATransport processRead start
             unknown = 10:37:03: CATransport handle response
             unknown = 10:37:03: CATransport processRead end
OCKSERVER:PVS:ACTIVE = 10:37:03: PVReaderImpl valueChange
OCKSERVER:PVS:ACTIVE = 10:37:03: PVManagerObservable valueChange true
             unknown = 10:37:03: Flow control activates
             unknown = 10:37:03: CATransport processRead start
             unknown = 10:37:03: CATransport processRead end
             unknown = 10:37:03: CATransport processRead start
             unknown = 10:37:03: CATransport processRead end
             unknown = 10:37:03: CATransport processRead start
             unknown = 10:37:03: CATransport processRead end
             unknown = 10:37:03: CATransport processRead start
             unknown = 10:37:03: CATransport handle response
             unknown = 10:37:03: CATransport processRead end
:PVS:INTEREST:MEDIUM = 10:37:03: PVReaderImpl valueChange
             unknown = 10:37:03: CATransport processRead start
:PVS:INTEREST:MEDIUM = 10:37:03: PVManagerObservable valueChange true
             unknown = 10:37:03: CATransport processRead end
             unknown = 10:37:03: CATransport read
             unknown = 10:37:03: CATransport processRead start
             unknown = 10:37:03: CATransport processRead end
             unknown = 10:37:03: CATransport processRead start
             unknown = 10:37:03: CATransport handle response
             unknown = 10:37:03: CATransport processRead start
             unknown = 10:37:03: CATransport processRead end
             unknown = 10:37:03: CATransport processRead end
             unknown = 10:37:03: CATransport processRead start
NSTETC_01:DEVIOS:TOD = 10:37:03: PVReaderImpl valueChange
NSTETC_01:DEVIOS:TOD = 10:37:03: PVManagerObservable valueChange true
             unknown = 10:37:03: CATransport handle response
             unknown = 10:37:03: CATransport processRead end
:BLOCKSERVER:PVS:ALL = 10:37:03: PVReaderImpl valueChange
```

...

```
             unknown = 10:37:33: CATransport read
             unknown = 10:37:33: CATransport processRead start
             unknown = 10:37:33: CATransport processRead end
             unknown = 10:37:33: CATransport read
             unknown = 10:37:33: CATransport processRead start
407:CS:SB:TEMP1.DESC = 10:37:33: CAResponseHandler id (18 is connection, 23 response) 18
407:CS:SB:TEMP1.SEVR = 10:37:33: CAResponseHandler id (18 is connection, 23 response) 18
:NDW1407:CS:SB:TEMP1 = 10:37:33: CAResponseHandler id (18 is connection, 23 response) 18
407:CS:SB:TEMP1.DESC = 10:37:33: CAJChannel connect complete changegov.aps.jca.Channel$ConnectionState[DISCONNECTED=1]
407:CS:SB:TEMP1.DESC = 10:37:33: CAJChannel connect changegov.aps.jca.Channel$ConnectionState[CONNECTED=2]
407:CS:SB:TEMP1.DESC = 10:37:33: MultiplexChannelHandler connect changeJCAConnection [connected: true writeConnected: true channel: CAJChannel = { name = TE:NDW1407:CS:SB:TEMP1.DESC, connectionState = CONNECTED }]
407:CS:SB:TEMP1.DESC = 10:37:33: ConnectionCollector connect changetrue
407:CS:SB:TEMP1.DESC = 10:37:33: PVDirector connected or exception event true
407:CS:SB:TEMP1.DESC = 10:37:33: PVReaderImpl connection
407:CS:SB:TEMP1.DESC = 10:37:33: PVManagerObservable connection true
407:CS:SB:TEMP1.DESC = 10:37:33: CreateChannel connect complete
             unknown = 10:37:33: CATransport processRead end
             unknown = 10:37:33: CATransport processRead start
407:CS:SB:TEMP1.DESC = 10:37:33: CAResponseHandler id (18 is connection, 23 response) 18
W1407:CS:SB:TEMP1:SP = 10:37:33: CAResponseHandler id (18 is connection, 23 response) 18
             unknown = 10:37:33: CATransport read
407:CS:SB:TEMP1.SEVR = 10:37:33: CAResponseHandler id (18 is connection, 23 response) 18
             unknown = 10:37:33: CATransport processRead start
:NDW1407:CS:SB:TEMP1 = 10:37:33: CAResponseHandler id (18 is connection, 23 response) 18
             unknown = 10:37:33: CATransport processRead end
:NDW1407:CS:SB:TEMP1 = 10:37:33: CAJChannel connect complete changegov.aps.jca.Channel$ConnectionState[DISCONNECTED=1]
:NDW1407:CS:SB:TEMP1 = 10:37:33: CAJChannel connect changegov.aps.jca.Channel$ConnectionState[CONNECTED=2]
:NDW1407:CS:SB:TEMP1 = 10:37:33: MultiplexChannelHandler connect changeJCAConnection [connected: true writeConnected: false channel: CAJChannel = { name = TE:NDW1407:CS:SB:TEMP1, connectionState = CONNECTED }]
:NDW1407:CS:SB:TEMP1 = 10:37:33: ConnectionCollector connect changetrue
:NDW1407:CS:SB:TEMP1 = 10:37:33: ConnectionCollector connect changetrue
:NDW1407:CS:SB:TEMP1 = 10:37:33: ConnectionCollector connect changefalse
:NDW1407:CS:SB:TEMP1 = 10:37:33: PVDirector connected or exception event true
:NDW1407:CS:SB:TEMP1 = 10:37:33: PVReaderImpl connection
:NDW1407:CS:SB:TEMP1 = 10:37:33: PVManagerObservable connection true
:NDW1407:CS:SB:TEMP1 = 10:37:33: DisplayBlock connection true
:NDW1407:CS:SB:TEMP1 = 10:37:33: CreateChannel connect complete
```

## Wireshark

Wireshark containing EUROTHERM:A01:TEMP

```
No.	Time	Source	Destination	Protocol	Length	Info
8039	37:00.7	127.0.0.1	127.255.255.255	UDP	1420	62379  >  5064 Len=680
8040	37:00.7	130.246.49.131	130.246.51.255	UDP	1420	62379  >  5064 Len=680
17775	37:04.1	127.0.0.1	127.255.255.255	UDP	268	65517  >  5064 Len=104
17781	37:04.1	130.246.49.131	130.246.51.255	UDP	268	65517  >  5064 Len=104
17786	37:04.1	127.0.0.1	127.0.0.1	TCP	324	53442  >  53440 [PSH, ACK] Seq=1 Ack=1 Win=8192 Len=120
23373	37:10.5	127.0.0.1	127.255.255.255	UDP	524	63107  >  5064 Len=232
23374	37:10.5	130.246.49.131	130.246.51.255	UDP	524	63107  >  5064 Len=232
23379	37:10.5	127.0.0.1	127.0.0.1	TCP	660	53443  >  53440 [PSH, ACK] Seq=1 Ack=1 Win=8192 Len=288
27003	37:15.2	127.0.0.1	127.255.255.255	UDP	2028	58905  >  5064 Len=984
27057	37:15.2	127.0.0.1	127.0.0.1	TCP	212	53445  >  53440 [PSH, ACK] Seq=537 Ack=273 Win=7680 Len=64
27066	37:15.2	127.0.0.1	127.0.0.1	TCP	196	53445  >  53440 [PSH, ACK] Seq=657 Ack=305 Win=7680 Len=56
37310	37:33.5	127.0.0.1	127.255.255.255	UDP	1420	62379  >  5064 Len=680
37312	37:33.5	130.246.49.131	130.246.51.255	UDP	1420	62379  >  5064 Len=680
37375	37:33.5	127.0.0.1	127.0.0.1	TCP	196	53452  >  53440 [PSH, ACK] Seq=73 Ack=17 Win=7936 Len=56
37380	37:33.5	127.0.0.1	127.0.0.1	TCP	180	53452  >  53440 [PSH, ACK] Seq=129 Ack=17 Win=7936 Len=48
```

### Selected packets with data

```
8039	09:37:00.701447	127.0.0.1	127.255.255.255	UDP	1420	62379 → 5064 Len=680
0000   02 00 00 00 45 00 02 c4 3a 3b 00 00 80 11 00 00  ....E...:;......
0010   7f 00 00 01 7f ff ff ff f3 ab 13 c8 02 b0 01 c2  ................
0020   00 00 00 00 00 01 00 0b 00 00 00 78 00 00 00 00  ...........x....
0030   00 06 00 28 00 05 00 0b 00 00 00 b8 00 00 00 b8  ...(............
0040   54 45 3a 4e 44 57 31 34 30 37 3a 45 55 52 4f 54  TE:NDW1407:EUROT
0050   48 52 4d 5f 30 31 3a 41 30 31 3a 54 45 4d 50 3a  HRM_01:A01:TEMP:
0060   53 50 00 00 00 00 00 00 00 06 00 20 00 05 00 0b  SP......... ....
0070   00 00 00 b7 00 00 00 b7 54 45 3a 4e 44 57 31 34  ........TE:NDW14
0080   30 37 3a 45 55 52 4f 54 48 52 4d 5f 30 31 3a 41  07:EUROTHRM_01:A
0090   30 31 3a 54 45 4d 50 00 00 06 00 20 00 05 00 0b  01:TEMP.... ....
00a0   00 00 00 99 00 00 00 99 54 45 3a 4e 44 57 31 34  ........TE:NDW14
00b0   30 37 3a 43 53 3a 53 42 3a 54 45 4d 50 31 2e 44  07:CS:SB:TEMP1.D
00c0   45 53 43 00 00 00 00 00 00 06 00 20 00 05 00 0b  ESC........ ....
00d0   00 00 00 9a 00 00 00 9a 54 45 3a 4e 44 57 31 34  ........TE:NDW14
00e0   30 37 3a 43 53 3a 53 42 3a 54 45 4d 50 31 2e 53  07:CS:SB:TEMP1.S
00f0   45 56 52 00 00 00 00 00 00 06 00 18 00 05 00 0b  EVR.............
0100   00 00 00 98 00 00 00 98 54 45 3a 4e 44 57 31 34  ........TE:NDW14
0110   30 37 3a 43 53 3a 53 42 3a 54 45 4d 50 31 00 00  07:CS:SB:TEMP1..
0120   00 06 00 20 00 05 00 0b 00 00 00 bd 00 00 00 bd  ... ............
0130   54 45 3a 4e 44 57 31 34 30 37 3a 43 53 3a 53 42  TE:NDW1407:CS:SB
0140   3a 54 45 4d 50 31 3a 53 50 00 00 00 00 00 00 00  :TEMP1:SP.......
0150   00 06 00 18 00 05 00 0b 00 00 00 46 00 00 00 46  ...........F...F
0160   54 45 3a 4e 44 57 31 34 30 37 3a 53 48 54 52 3a  TE:NDW1407:SHTR:
0170   53 54 41 54 00 00 00 00 00 06 00 20 00 05 00 0b  STAT....... ....
0180   00 00 00 b9 00 00 00 b9 54 45 3a 4e 44 57 31 34  ........TE:NDW14
0190   30 37 3a 45 55 52 4f 54 48 52 4d 5f 30 31 24 28  07:EUROTHRM_01$(
01a0   44 45 56 50 56 32 29 00 00 06 00 28 00 05 00 0b  DEVPV2)....(....
01b0   00 00 00 ba 00 00 00 ba 54 45 3a 4e 44 57 31 34  ........TE:NDW14
01c0   30 37 3a 45 55 52 4f 54 48 52 4d 5f 30 31 24 28  07:EUROTHRM_01$(
01d0   44 45 56 50 56 32 29 3a 53 50 00 00 00 00 00 00  DEVPV2):SP......
01e0   00 06 00 20 00 05 00 0b 00 00 00 bb 00 00 00 bb  ... ............
01f0   54 45 3a 4e 44 57 31 34 30 37 3a 45 55 52 4f 54  TE:NDW1407:EUROT
0200   48 52 4d 5f 30 31 24 28 44 45 56 50 56 33 29 00  HRM_01$(DEVPV3).
0210   00 06 00 28 00 05 00 0b 00 00 00 bc 00 00 00 bc  ...(............
0220   54 45 3a 4e 44 57 31 34 30 37 3a 45 55 52 4f 54  TE:NDW1407:EUROT
0230   48 52 4d 5f 30 31 24 28 44 45 56 50 56 33 29 3a  HRM_01$(DEVPV3):
0240   53 50 00 00 00 00 00 00 00 06 00 10 00 05 00 0b  SP..............
0250   00 00 00 be 00 00 00 be 24 28 47 45 4e 50 56 32  ........$(GENPV2
0260   29 00 00 00 00 00 00 00 00 06 00 10 00 05 00 0b  )...............
0270   00 00 00 bf 00 00 00 bf 24 28 47 45 4e 50 56 32  ........$(GENPV2
0280   29 3a 53 50 00 00 00 00 00 06 00 10 00 05 00 0b  ):SP............
0290   00 00 00 c0 00 00 00 c0 24 28 47 45 4e 50 56 33  ........$(GENPV3
02a0   29 00 00 00 00 00 00 00 00 06 00 10 00 05 00 0b  )...............
02b0   00 00 00 c1 00 00 00 c1 24 28 47 45 4e 50 56 33  ........$(GENPV3
02c0   29 3a 53 50 00 00 00 00                          ):SP....
```

```
17775	09:37:04.099535	127.0.0.1	127.255.255.255	UDP	268	65517 → 5064 Len=104
0000   02 00 00 00 45 00 00 84 60 3c 00 00 80 11 00 00  ....E...`<......
0010   7f 00 00 01 7f ff ff ff ff ed 13 c8 00 70 ff 81  .............p..
0020   00 00 00 00 00 01 00 0d 00 00 00 19 00 00 00 00  ................
0030   00 06 00 20 00 05 00 0d 00 00 00 01 00 00 00 01  ... ............
0040   54 45 3a 4e 44 57 31 34 30 37 3a 45 55 52 4f 54  TE:NDW1407:EUROT
0050   48 52 4d 5f 30 31 3a 41 30 31 3a 54 45 4d 50 00  HRM_01:A01:TEMP.
0060   00 06 00 18 00 05 00 0d 00 00 00 02 00 00 00 02  ................
0070   54 45 3a 4e 44 57 31 34 30 37 3a 43 53 3a 53 42  TE:NDW1407:CS:SB
0080   3a 54 45 4d 50 31 00 00                          :TEMP1..
```

```
23373	09:37:10.487686	127.0.0.1	127.255.255.255	UDP	524	63107 → 5064 Len=232
0000   02 00 00 00 45 00 01 04 76 13 00 00 80 11 00 00  ....E...v.......
0010   7f 00 00 01 7f ff ff ff f6 83 13 c8 00 f0 00 02  ................
0020   00 00 00 00 00 01 00 0d 00 00 01 52 00 00 00 00  ...........R....
0030   00 06 00 28 00 05 00 0d 00 00 00 16 00 00 00 16  ...(............
0040   54 45 3a 4e 44 57 31 34 30 37 3a 45 55 52 4f 54  TE:NDW1407:EUROT
0050   48 52 4d 5f 30 31 3a 41 30 31 3a 54 45 4d 50 2e  HRM_01:A01:TEMP.
0060   44 45 53 43 00 00 00 00 00 06 00 28 00 05 00 0d  DESC.......(....
0070   00 00 00 17 00 00 00 17 54 45 3a 4e 44 57 31 34  ........TE:NDW14
0080   30 37 3a 45 55 52 4f 54 48 52 4d 5f 30 31 3a 41  07:EUROTHRM_01:A
0090   30 31 3a 54 45 4d 50 2e 53 45 56 52 00 00 00 00  01:TEMP.SEVR....
00a0   00 06 00 20 00 05 00 0d 00 00 00 15 00 00 00 15  ... ............
00b0   54 45 3a 4e 44 57 31 34 30 37 3a 45 55 52 4f 54  TE:NDW1407:EUROT
00c0   48 52 4d 5f 30 31 3a 41 30 31 3a 54 45 4d 50 00  HRM_01:A01:TEMP.
00d0   00 06 00 28 00 05 00 0d 00 00 00 18 00 00 00 18  ...(............
00e0   54 45 3a 4e 44 57 31 34 30 37 3a 45 55 52 4f 54  TE:NDW1407:EUROT
00f0   48 52 4d 5f 30 31 3a 41 30 31 3a 54 45 4d 50 3a  HRM_01:A01:TEMP:
0100   53 50 00 00 00 00 00 00                          SP......
```

```
27003	09:37:15.200981	127.0.0.1	127.255.255.255	UDP	2028	58905 → 5064 Len=984
0000   02 00 00 00 45 00 03 f4 04 3b 00 00 80 11 00 00  ....E....;......
0010   7f 00 00 01 7f ff ff ff e6 19 13 c8 03 e0 02 f2  ................
0020   00 00 00 00 00 01 00 0b 00 00 01 6d 00 00 00 00  ...........m....
0030   00 06 00 30 00 05 00 0b 00 00 03 43 00 00 03 43  ...0.......C...C
0040   54 45 3a 4e 44 57 31 34 30 37 3a 45 55 52 4f 54  TE:NDW1407:EUROT
0050   48 52 4d 5f 30 31 3a 41 30 33 3a 43 41 4c 3a 53  HRM_01:A03:CAL:S
0060   45 4c 3a 52 42 56 2e 56 41 4c 00 00 00 00 00 00  EL:RBV.VAL......
0070   00 06 00 28 00 05 00 0b 00 00 03 30 00 00 03 30  ...(.......0...0
0080   54 45 3a 4e 44 57 31 34 30 37 3a 45 55 52 4f 54  TE:NDW1407:EUROT
0090   48 52 4d 5f 30 31 3a 41 30 32 3a 45 52 52 5f 52  HRM_01:A02:ERR_R
00a0   45 41 44 2e 56 41 4c 00 00 06 00 28 00 05 00 0b  EAD.VAL....(....
00b0   00 00 03 61 00 00 03 61 54 45 3a 4e 44 57 31 34  ...a...aTE:NDW14
00c0   30 37 3a 45 55 52 4f 54 48 52 4d 5f 30 31 3a 41  07:EUROTHRM_01:A
00d0   30 34 3a 50 2e 56 41 4c 00 00 00 00 00 00 00 00  04:P.VAL........
00e0   00 06 00 28 00 05 00 0b 00 00 03 40 00 00 03 40  ...(.......@...@
00f0   54 45 3a 4e 44 57 31 34 30 37 3a 45 55 52 4f 54  TE:NDW1407:EUROT
0100   48 52 4d 5f 30 31 3a 41 30 32 3a 5f 53 50 2e 56  HRM_01:A02:_SP.V
0110   41 4c 00 00 00 00 00 00 00 06 00 28 00 05 00 0b  AL.........(....
0120   00 00 03 55 00 00 03 55 54 45 3a 4e 44 57 31 34  ...U...UTE:NDW14
0130   30 37 3a 45 55 52 4f 54 48 52 4d 5f 30 31 3a 41  07:EUROTHRM_01:A
0140   30 33 3a 5f 43 48 45 43 4b 53 50 2e 56 41 4c 00  03:_CHECKSP.VAL.
0150   00 06 00 28 00 05 00 0b 00 00 03 2b 00 00 03 2b  ...(.......+...+
0160   54 45 3a 4e 44 57 31 34 30 37 3a 45 55 52 4f 54  TE:NDW1407:EUROT
0170   48 52 4d 5f 30 31 3a 41 30 32 3a 43 41 4c 3a 52  HRM_01:A02:CAL:R
0180   42 56 2e 56 41 4c 00 00 00 06 00 28 00 05 00 0b  BV.VAL.....(....
0190   00 00 03 6c 00 00 03 6c 54 45 3a 4e 44 57 31 34  ...l...lTE:NDW14
01a0   30 37 3a 45 55 52 4f 54 48 52 4d 5f 30 31 3a 41  07:EUROTHRM_01:A
01b0   30 34 3a 5f 53 50 2e 56 41 4c 00 00 00 00 00 00  04:_SP.VAL......
01c0   00 06 00 30 00 05 00 0b 00 00 03 39 00 00 03 39  ...0.......9...9
01d0   54 45 3a 4e 44 57 31 34 30 37 3a 45 55 52 4f 54  TE:NDW1407:EUROT
01e0   48 52 4d 5f 30 31 3a 41 30 32 3a 53 50 3a 52 45  HRM_01:A02:SP:RE
01f0   54 52 59 43 4e 54 2e 56 41 4c 00 00 00 00 00 00  TRYCNT.VAL......
0200   00 06 00 30 00 05 00 0b 00 00 03 28 00 00 03 28  ...0.......(...(
0210   54 45 3a 4e 44 57 31 34 30 37 3a 45 55 52 4f 54  TE:NDW1407:EUROT
0220   48 52 4d 5f 30 31 3a 41 30 31 3a 54 45 4d 50 3a  HRM_01:A01:TEMP:
0230   53 50 3a 52 42 56 2e 56 41 4c 00 00 00 00 00 00  SP:RBV.VAL......
0240   00 06 00 28 00 05 00 0b 00 00 03 36 00 00 03 36  ...(.......6...6
0250   54 45 3a 4e 44 57 31 34 30 37 3a 45 55 52 4f 54  TE:NDW1407:EUROT
0260   48 52 4d 5f 30 31 3a 41 30 32 3a 52 42 56 2e 56  HRM_01:A02:RBV.V
0270   41 4c 00 00 00 00 00 00 00 06 00 28 00 05 00 0b  AL.........(....
0280   00 00 03 27 00 00 03 27 54 45 3a 4e 44 57 31 34  ...'...'TE:NDW14
0290   30 37 3a 45 55 52 4f 54 48 52 4d 5f 30 31 3a 41  07:EUROTHRM_01:A
02a0   30 31 3a 54 45 4d 50 3a 53 50 2e 56 41 4c 00 00  01:TEMP:SP.VAL..
02b0   00 06 00 28 00 05 00 0b 00 00 03 3f 00 00 03 3f  ...(.......?...?
02c0   54 45 3a 4e 44 57 31 34 30 37 3a 45 55 52 4f 54  TE:NDW1407:EUROT
02d0   48 52 4d 5f 30 31 3a 41 30 32 3a 5f 43 48 45 43  HRM_01:A02:_CHEC
02e0   4b 53 50 2e 56 41 4c 00 00 06 00 28 00 05 00 0b  KSP.VAL....(....
02f0   00 00 03 6b 00 00 03 6b 54 45 3a 4e 44 57 31 34  ...k...kTE:NDW14
0300   30 37 3a 45 55 52 4f 54 48 52 4d 5f 30 31 3a 41  07:EUROTHRM_01:A
0310   30 34 3a 5f 43 48 45 43 4b 53 50 2e 56 41 4c 00  04:_CHECKSP.VAL.
0320   00 06 00 28 00 05 00 0b 00 00 03 41 00 00 03 41  ...(.......A...A
0330   54 45 3a 4e 44 57 31 34 30 37 3a 45 55 52 4f 54  TE:NDW1407:EUROT
0340   48 52 4d 5f 30 31 3a 41 30 33 3a 43 41 4c 3a 52  HRM_01:A03:CAL:R
0350   42 56 2e 56 41 4c 00 00 00 06 00 28 00 05 00 0b  BV.VAL.....(....
0360   00 00 03 2e 00 00 03 2e 54 45 3a 4e 44 57 31 34  ........TE:NDW14
0370   30 37 3a 45 55 52 4f 54 48 52 4d 5f 30 31 3a 41  07:EUROTHRM_01:A
0380   30 32 3a 44 2e 56 41 4c 00 00 00 00 00 00 00 00  02:D.VAL........
0390   00 06 00 28 00 05 00 0b 00 00 03 97 00 00 03 97  ...(............
03a0   54 45 3a 4e 44 57 31 34 30 37 3a 4d 4f 54 3a 48  TE:NDW1407:MOT:H
03b0   49 46 49 3a 42 41 52 4e 44 4f 4f 52 53 2e 43 4e  IFI:BARNDOORS.CN
03c0   45 4e 00 00 00 00 00 00 00 06 00 20 00 05 00 0b  EN......... ....
03d0   00 00 03 c3 00 00 03 c3 54 45 3a 4e 44 57 31 34  ........TE:NDW14
03e0   30 37 3a 4d 4f 54 3a 4d 54 52 30 31 30 33 2e 56  07:MOT:MTR0103.V
03f0   41 4c 00 00 00 00 00 00                          AL......
```

```
37310	09:37:33.467759	127.0.0.1	127.255.255.255	UDP	1420	62379 → 5064 Len=680
0000   02 00 00 00 45 00 02 c4 2c 63 00 00 80 11 00 00  ....E...,c......
0010   7f 00 00 01 7f ff ff ff f3 ab 13 c8 02 b0 01 c2  ................
0020   00 00 00 00 00 01 00 0b 00 00 00 79 00 00 00 00  ...........y....
0030   00 06 00 28 00 05 00 0b 00 00 00 b8 00 00 00 b8  ...(............
0040   54 45 3a 4e 44 57 31 34 30 37 3a 45 55 52 4f 54  TE:NDW1407:EUROT
0050   48 52 4d 5f 30 31 3a 41 30 31 3a 54 45 4d 50 3a  HRM_01:A01:TEMP:
0060   53 50 00 00 00 00 00 00 00 06 00 20 00 05 00 0b  SP......... ....
0070   00 00 00 b7 00 00 00 b7 54 45 3a 4e 44 57 31 34  ........TE:NDW14
0080   30 37 3a 45 55 52 4f 54 48 52 4d 5f 30 31 3a 41  07:EUROTHRM_01:A
0090   30 31 3a 54 45 4d 50 00 00 06 00 20 00 05 00 0b  01:TEMP.... ....
00a0   00 00 00 99 00 00 00 99 54 45 3a 4e 44 57 31 34  ........TE:NDW14
00b0   30 37 3a 43 53 3a 53 42 3a 54 45 4d 50 31 2e 44  07:CS:SB:TEMP1.D
00c0   45 53 43 00 00 00 00 00 00 06 00 20 00 05 00 0b  ESC........ ....
00d0   00 00 00 9a 00 00 00 9a 54 45 3a 4e 44 57 31 34  ........TE:NDW14
00e0   30 37 3a 43 53 3a 53 42 3a 54 45 4d 50 31 2e 53  07:CS:SB:TEMP1.S
00f0   45 56 52 00 00 00 00 00 00 06 00 18 00 05 00 0b  EVR.............
0100   00 00 00 98 00 00 00 98 54 45 3a 4e 44 57 31 34  ........TE:NDW14
0110   30 37 3a 43 53 3a 53 42 3a 54 45 4d 50 31 00 00  07:CS:SB:TEMP1..
0120   00 06 00 20 00 05 00 0b 00 00 00 bd 00 00 00 bd  ... ............
0130   54 45 3a 4e 44 57 31 34 30 37 3a 43 53 3a 53 42  TE:NDW1407:CS:SB
0140   3a 54 45 4d 50 31 3a 53 50 00 00 00 00 00 00 00  :TEMP1:SP.......
0150   00 06 00 18 00 05 00 0b 00 00 00 46 00 00 00 46  ...........F...F
0160   54 45 3a 4e 44 57 31 34 30 37 3a 53 48 54 52 3a  TE:NDW1407:SHTR:
0170   53 54 41 54 00 00 00 00 00 06 00 20 00 05 00 0b  STAT....... ....
0180   00 00 00 b9 00 00 00 b9 54 45 3a 4e 44 57 31 34  ........TE:NDW14
0190   30 37 3a 45 55 52 4f 54 48 52 4d 5f 30 31 24 28  07:EUROTHRM_01$(
01a0   44 45 56 50 56 32 29 00 00 06 00 28 00 05 00 0b  DEVPV2)....(....
01b0   00 00 00 ba 00 00 00 ba 54 45 3a 4e 44 57 31 34  ........TE:NDW14
01c0   30 37 3a 45 55 52 4f 54 48 52 4d 5f 30 31 24 28  07:EUROTHRM_01$(
01d0   44 45 56 50 56 32 29 3a 53 50 00 00 00 00 00 00  DEVPV2):SP......
01e0   00 06 00 20 00 05 00 0b 00 00 00 bb 00 00 00 bb  ... ............
01f0   54 45 3a 4e 44 57 31 34 30 37 3a 45 55 52 4f 54  TE:NDW1407:EUROT
0200   48 52 4d 5f 30 31 24 28 44 45 56 50 56 33 29 00  HRM_01$(DEVPV3).
0210   00 06 00 28 00 05 00 0b 00 00 00 bc 00 00 00 bc  ...(............
0220   54 45 3a 4e 44 57 31 34 30 37 3a 45 55 52 4f 54  TE:NDW1407:EUROT
0230   48 52 4d 5f 30 31 24 28 44 45 56 50 56 33 29 3a  HRM_01$(DEVPV3):
0240   53 50 00 00 00 00 00 00 00 06 00 10 00 05 00 0b  SP..............
0250   00 00 00 be 00 00 00 be 24 28 47 45 4e 50 56 32  ........$(GENPV2
0260   29 00 00 00 00 00 00 00 00 06 00 10 00 05 00 0b  )...............
0270   00 00 00 bf 00 00 00 bf 24 28 47 45 4e 50 56 32  ........$(GENPV2
0280   29 3a 53 50 00 00 00 00 00 06 00 10 00 05 00 0b  ):SP............
0290   00 00 00 c0 00 00 00 c0 24 28 47 45 4e 50 56 33  ........$(GENPV3
02a0   29 00 00 00 00 00 00 00 00 06 00 10 00 05 00 0b  )...............
02b0   00 00 00 c1 00 00 00 c1 24 28 47 45 4e 50 56 33  ........$(GENPV3
02c0   29 3a 53 50 00 00 00 00                          ):SP....
```

```
37380	09:37:33.470353	127.0.0.1	127.0.0.1	TCP	180	53452 → 53440 [PSH, ACK] Seq=129 Ack=17 Win=7936 Len=48
0000   02 00 00 00 45 00 00 58 2c a8 40 00 80 06 00 00  ....E..X,.@.....
0010   7f 00 00 01 7f 00 00 01 d0 cc d0 c0 87 a0 e8 d8  ................
0020   80 c6 2e d6 50 18 00 1f fe 4c 00 00 00 12 00 20  ....P....L..... 
0030   00 00 00 00 00 00 00 b7 00 00 00 0d 54 45 3a 4e  ............TE:N
0040   44 57 31 34 30 37 3a 45 55 52 4f 54 48 52 4d 5f  DW1407:EUROTHRM_
0050   30 31 3a 41 30 31 3a 54 45 4d 50 00              01:A01:TEMP.
```



# netstat -abon

```
[EUROTHRM-IOC-01.exe]
  TCP    127.0.0.1:53440        0.0.0.0:0              LISTENING       19192
 [EUROTHRM-IOC-01.exe]
  TCP    127.0.0.1:53440        127.0.0.1:53442        ESTABLISHED     19192
 [EUROTHRM-IOC-01.exe]
  TCP    127.0.0.1:53440        127.0.0.1:53443        ESTABLISHED     19192
 [EUROTHRM-IOC-01.exe]
  TCP    127.0.0.1:53440        127.0.0.1:53444        ESTABLISHED     19192
 [EUROTHRM-IOC-01.exe]
  TCP    127.0.0.1:53440        127.0.0.1:53445        ESTABLISHED     19192
 [EUROTHRM-IOC-01.exe]
  TCP    127.0.0.1:53440        127.0.0.1:53510        ESTABLISHED     19192
 [EUROTHRM-IOC-01.exe]
  TCP    127.0.0.1:53441        127.0.0.1:7011         ESTABLISHED     19192
 [EUROTHRM-IOC-01.exe]
  TCP    127.0.0.1:53442        127.0.0.1:53440        ESTABLISHED     15284
 [camonitor.exe]
  TCP    127.0.0.1:53443        127.0.0.1:53440        ESTABLISHED     8568
 [gateway.exe]
  TCP    127.0.0.1:53444        127.0.0.1:53440        ESTABLISHED     13664
```

**Comment by John-Holt-Tessella** [comment]
See https://github.com/ISISComputingGroup/ibex_developers_manual/wiki/PV-Connection-Layer

**Comment by Tom-Willemsen** [comment]
On this page [https://github.com/ISISComputingGroup/ibex_developers_manual/wiki/PV-Manager-and-Observers-Logging](https://github.com/ISISComputingGroup/ibex_developers_manual/wiki/PV-Manager-and-Observers-Logging) could you be a bit more explicit about exactly how I should set up logging if I want to in the future.

For example, I don't already have this repository on my system and it's not entirely clear where I should check it out to.

Also, "Run with the following plugins from the workspace instead of the P2 repository": it's not entirely clear how to do this. Could you give step-by-step instructions (or link to another page giving these instructions) on how to do this.

Some rudimentary details on how wireshark might be set up would also be appreciated.

**Comment by John-Holt-Tessella** [comment]
Done and linked from page
