### ISSUE TITLE
Galil: Occasional timeouts on various instruments

### ISSUE THREAD

**Issue by DominicOram** [ISISComputingGroup/IBEX#6346]
As an IBEX user I would like the values coming from my Galils to be reliable. The following sort of errors are occuring on many Galils around site:
```
[2021-03-23 00:23:21] GalilController::get_integer:GalilController::writeReadController:MG _CN1:1011 TIMEOUT ERROR.  Galil::command("MG _CN1") took longer than 1000 ms to read : response.

[2021-03-23 00:23:21] sevr=major MG _CN1: ERROR.  Galil::command("MG _CN1") took longer than 1000 ms to read : response

[2021-03-23 00:23:22] sevr=major acquireDataRecord:DMC2280 Rev 1.0o-CM:192.168.1.202: 1153 TIMEOUT ERROR.  Galil::record("QR") took longer than 1000 ms to read 269 bytes.  Got 0 bytes

[2021-03-23 00:23:22] 

[2021-03-23 00:23:23] GalilController::get_integer:GalilController::writeReadController:MG _CA:1011 TIMEOUT ERROR.  Galil::command("MG _CA") took longer than 1000 ms to read : response.

[2021-03-23 00:23:23] sevr=major MG _CA: ERROR.  Galil::command("MG _CA") took longer than 1000 ms to read : response

[2021-03-23 00:23:25] sevr=major acquireDataRecord:DMC2280 Rev 1.0o-CM:192.168.1.202: 1153 TIMEOUT ERROR.  Galil::record("QR") took longer than 1000 ms to read 269 bytes.  Got 0 bytes
```

Axes on the Galil will also periodically report being at 0 for ~4 seconds: 
![image](https://user-images.githubusercontent.com/10086797/112205859-2baaa800-8c0d-11eb-911e-b2ac3156e56a.png)
This issue was originally seen on SURF but has also been seen on IMAT and CRISP. however, it is not present on LARMOR. It also causes the Galil to get into a state where it continually logs:
```
[2021-03-23 00:23:37] QAbstractSocket::waitForBytesWritten() is not allowed in UnconnectedState

[2021-03-23 00:23:37] QAbstractSocket::waitForBytesWritten() is not allowed in UnconnectedState

[2021-03-23 00:23:37] QAbstractSocket::waitForBytesWritten() is not allowed in UnconnectedState
```
Causing ~200 MB of logs a day per galil.

## Acceptance Criteria
* The above issue is fixed

**Comment by DominicOram** [comment]
On ZOOM, this error was seen on all Galils 02/11/21 but subsequently cleared up on the same day and was not seen again.

**Comment by FreddieAkeroyd** [comment]
Before timeout on crisp i always see
```
[2021-03-29 18:11:06] Discarding unsolicited message: "TC" axis="P" value="lost"
[2021-03-29 18:11:06] Discarding unsolicited message: "sync" axis=" " value="or"
[2021-03-29 18:11:06] Discarding unsolicited message: "timeout" axis=" " value="-"
[2021-03-29 18:11:06] Discarding unsolicited message: "Handle" axis=" " value="-"
[2021-03-29 18:11:06] Discarding unsolicited message: "1.0000" axis=" " value=""
```

**Comment by FreddieAkeroyd** [comment]
Increasing timeout didn't do anything as code only applied it on serial connections. Rebuilding to try that.

**Comment by DominicOram** [comment]
Docs don't really give any indication of why the "TCP lost sync" error might happen, other than a disconnected cable. But it does run an error subroutine on the galil when it happens, could we do something on the galil side to attempt to re-establish the connection?

**Comment by FreddieAkeroyd** [comment]
I think it says it closes the handle on such conditions. we could also try udp for unsolocited messages. We are also still getting `QAbstractSocket::waitForBytesWritten() is not allowed in UnconnectedState` which is reasonable if the galil closes the handle. Maybe reverting to yet more udp will help...

**Comment by FreddieAkeroyd** [comment]
Trying code on https://github.com/ISISComputingGroup/EPICS-galil/tree/test_dr with jenkins BuildTest

**Comment by FreddieAkeroyd** [comment]
OK, so can get error if just run IOC on its own, rest of ibex shutdown. shutting down nagios no change. Ran up wireshark and got the following when the errors happened
```
43615	230.990135	192.168.1.1	192.168.1.202	TELNET	60	Telnet Data ...
43616	230.993001	192.168.1.202	192.168.1.1	TELNET	60	Telnet Data ...
43630	231.235974	192.168.1.202	192.168.1.1	TCP	60	[TCP Retransmission] 23 → 49632 [PSH, ACK] Seq=153678 Ack=117542 Win=450 Len=5
43634	231.291918	192.168.1.1	192.168.1.202	TELNET	60	[TCP Spurious Retransmission] Telnet Data ...
43635	231.292487	192.168.1.202	192.168.1.1	TCP	60	[TCP Retransmission] 23 → 49632 [PSH, ACK] Seq=153678 Ack=117542 Win=450 Len=5
43645	231.480327	192.168.1.202	192.168.1.1	TCP	60	[TCP Retransmission] 23 → 49632 [PSH, ACK] Seq=153678 Ack=117542 Win=450 Len=5
43659	231.724022	192.168.1.202	192.168.1.1	TCP	60	[TCP Retransmission] 23 → 49632 [PSH, ACK] Seq=153678 Ack=117542 Win=450 Len=5
43668	231.892541	192.168.1.1	192.168.1.202	TELNET	60	[TCP Spurious Retransmission] Telnet Data ...
43670	231.895389	192.168.1.202	192.168.1.1	TCP	60	[TCP Retransmission] 23 → 49632 [PSH, ACK] Seq=153678 Ack=117542 Win=450 Len=5
43733	233.092796	192.168.1.1	192.168.1.202	TELNET	60	[TCP Spurious Retransmission] Telnet Data ...
```

**Comment by FreddieAkeroyd** [comment]
Something seems to go wrong with tcp acknowledgements? I think windows updates are worth a go. Which machines are we seeing problems on - is it just the new Dell servers?

**Comment by rerpha** [comment]
Just been down to IMAT to wire up the galils via rs232 into the moxa, ports are as follows: 
galil 1 - ethernet port 18 - moxa port 9
galil 2 - ethernet port 19 - moxa port 10
galil 3 - ethernet port 20 - moxa port 11

galil 4 - ethernet port 23 - moxa port 12
galil 5 - ethernet port 24 - moxa port 3

**Comment by rerpha** [comment]
Galils 1-4 now look happy, after an IOC restart the weird trailing character thing went away

**Comment by DominicOram** [comment]
with affected instruments switched to serial is there anything more we can do with this ticket or shall we call it done @FreddieAkeroyd?

**Comment by FreddieAkeroyd** [comment]
I think we have done all we can at this point

**Comment by DominicOram** [comment]
Logs on reflectometry and IMAT no longer have issue. Motors seem happy
